{
  "contract": "ai_daily_context",
  "protocol_version": 1,
  "request_id": "12121212-1212-4121-8121-121212121212",
  "engine_version": "0.1.0",
  "engine_build": "fixture-engine-build-v1",
  "status": "partial",
  "file_context": "### 合成文件\n\n一个文件已生成可信上下文，另一个文件超时。",
  "summary": {
    "source_file_count": 2,
    "success_count": 1,
    "timeout_count": 1,
    "included_file_count": 1,
    "omitted_file_count": 1,
    "error_file_count": 0,
    "input_chars": 52,
    "output_chars": 42,
    "total_duration_ms": 60012,
    "discovery_duration_ms": 2,
    "parse_duration_ms": 60000,
    "compression_duration_ms": 1
  },
  "scan_run_id": 2,
  "context_run_id": 2,
  "warnings": [
    {
      "error_code": "PARSER_TIMEOUT",
      "message": "synthetic parser deadline exceeded",
      "retryable": true,
      "stage": "parse",
      "file_path": "C:\\scanner-fixtures\\工作 目录\\slow.xlsx",
      "backend": "rust_xlsx_bounded_v2"
    }
  ],
  "error": null
}
