{
  "contract": "ai_daily_context",
  "protocol_version": 1,
  "request_id": "11111111-1111-4111-8111-111111111111",
  "engine_version": "0.1.0",
  "engine_build": "fixture-engine-build-v1",
  "status": "ok",
  "file_context": "### 合成文件\n\n用于冻结 scanner v1 合同的纯测试文本。",
  "summary": {
    "source_file_count": 2,
    "success_count": 2,
    "timeout_count": 0,
    "included_file_count": 2,
    "omitted_file_count": 0,
    "error_file_count": 0,
    "input_chars": 80,
    "output_chars": 48,
    "total_duration_ms": 25,
    "discovery_duration_ms": 2,
    "parse_duration_ms": 18,
    "compression_duration_ms": 1
  },
  "scan_run_id": 1,
  "context_run_id": 1,
  "warnings": [],
  "error": null
}
